{
    "$schema": "../rails.schema.json",
    "unk0": 347218,
    "tile_width": 4096,
    "points": [
        {
            "name": "RE_POINT_0",
            "lines": [ 0, 65535, 65535, 65535 ],
            "dirs": [ 3, 0, 0, 0 ],
            "widths": [ 96, 16, 16, 16 ],
            "pos": [ 1015808, 131072, 229376 ],
            "camera": 0
        },
        {
            "name": "RE_POINT_1",
            "lines": [ 0, 1, 65535, 65535 ],
            "dirs": [ 1, 3, 0, 0 ],
            "widths": [ 96, 96, 16, 16 ],
            "pos": [ 1015808, 0, 3174400 ],
            "camera": 1
        },
        {
            "name": "RE_POINT_2",
            "lines": [ 1, 2, 65535, 65535 ],
            "dirs": [ 1, 3, 0, 0 ],
            "widths": [ 96, 96, 16, 16 ],
            "pos": [ 1015808, 0, 8421376 ],
            "camera": 2
        },
        {
            "name": "RE_POINT_3",
            "lines": [ 2, 65535, 65535, 65535 ],
            "dirs": [ 1, 0, 0, 0 ],
            "widths": [ 96, 16, 16, 16 ],
            "pos": [ 1015808, 0, 12746752 ],
            "camera": 3
        }
    ],
    "lines": [
        {
            "name": "RE_LINE_0",
            "point_a": 0,
            "point_b": 1,
            "dir": 3,
            "curve": 0,
            "camera": 4,
            "length": 45
        },
        {
            "name": "RE_LINE_1",
            "point_a": 1,
            "point_b": 2,
            "dir": 3,
            "curve": 1,
            "camera": 5,
            "length": 80
        },
        {
            "name": "RE_LINE_2",
            "point_a": 2,
            "point_b": 3,
            "dir": 3,
            "curve": 2,
            "camera": 6,
            "length": 66
        }
    ],
    "cameras": [
        {
            "func": 17,
            "params": [ 3112, 0, 917504, 0, 224000, -39200, 0, 0 ]
        },
        {
            "func": 17,
            "params": [ 3112, 0, 917504, 0, 224000, -39200, 0, 0 ]
        },
        {
            "func": 17,
            "params": [ 3112, 0, 917504, 0, 224000, -39200, 0, 0 ]
        },
        {
            "func": 19,
            "params": [ 3112, 0, 917504, 0, 224000, -39200, 0, 0 ]
        },
        {
            "func": 18,
            "params": [ 6568, 0, 917504, 0, 0, 0, 0, 0 ]
        },
        {
            "func": 19,
            "params": [ 9956, 0, 1986560, 0, 888832, 512704, 0, 0 ]
        },
        {
            "func": 18,
            "params": [ 6568, 0, 917504, 0, 0, 0, 0, 0 ]
        }
    ],
    "curves": [
        {
            "handler": 0,
            "center": [ 0, 0, 0 ]
        },
        {
            "handler": 0,
            "center": [ 0, 0, 0 ]
        },
        {
            "handler": 0,
            "center": [ 0, 0, 0 ]
        }
    ]
}
