{
    "$schema": "../rails.schema.json",
    "unk0": 347218,
    "tile_width": 4096,
    "points": [
        {
            "name": "POINT_GROUND2",
            "lines": [ 0, 3, 65535, 65535 ],
            "dirs": [ 3, 1, 0, 0 ],
            "widths": [ 16, 16, 16, 16 ],
            "pos": [ 753664, 458752, 1015808 ],
            "camera": 0
        },
        {
            "name": "POINT__2_RE_LINE_0",
            "lines": [ 2, 1, 65535, 65535 ],
            "dirs": [ 1, 3, 0, 0 ],
            "widths": [ 16, 16, 16, 16 ],
            "pos": [ 1277952, 1703936, 491520 ],
            "camera": 1
        },
        {
            "name": "POINT__3_RE_LINE_0",
            "lines": [ 4, 2, 65535, 65535 ],
            "dirs": [ 1, 3, 0, 0 ],
            "widths": [ 16, 16, 16, 16 ],
            "pos": [ 1802240, 1376256, 1015808 ],
            "camera": 2
        },
        {
            "name": "POINT__4_div_1_RE_LINE_0",
            "lines": [ 1, 5, 65535, 65535 ],
            "dirs": [ 1, 3, 0, 0 ],
            "widths": [ 16, 16, 16, 16 ],
            "pos": [ 753664, 2097152, 1015808 ],
            "camera": 3
        },
        {
            "name": "POINT_END",
            "lines": [ 3, 65535, 65535, 65535 ],
            "dirs": [ 3, 0, 0, 0 ],
            "widths": [ 16, 16, 16, 16 ],
            "pos": [ 753664, 327680, 688128 ],
            "camera": 4
        },
        {
            "name": "POINT__8_div_6_RE_LINE_0",
            "lines": [ 0, 4, 65535, 65535 ],
            "dirs": [ 1, 3, 0, 0 ],
            "widths": [ 16, 16, 16, 16 ],
            "pos": [ 1277952, 983040, 1540096 ],
            "camera": 5
        },
        {
            "name": "RE_POINT_6",
            "lines": [ 5, 65535, 65535, 65535 ],
            "dirs": [ 1, 0, 0, 0 ],
            "widths": [ 16, 16, 16, 16 ],
            "pos": [ 786432, 2215936, 1200128 ],
            "camera": 6
        }
    ],
    "lines": [
        {
            "name": "RE_LINE_0",
            "point_a": 5,
            "point_b": 0,
            "dir": 1,
            "curve": 0,
            "camera": 7,
            "length": 13
        },
        {
            "name": "div_1_RE_LINE_0",
            "point_a": 3,
            "point_b": 1,
            "dir": 1,
            "curve": 1,
            "camera": 8,
            "length": 13
        },
        {
            "name": "div_2_RE_LINE_0",
            "point_a": 1,
            "point_b": 2,
            "dir": 1,
            "curve": 2,
            "camera": 9,
            "length": 13
        },
        {
            "name": "RE_LINE_5",
            "point_a": 0,
            "point_b": 4,
            "dir": 1,
            "curve": 3,
            "camera": 10,
            "length": 5
        },
        {
            "name": "div_7_div_6_RE_LINE_0",
            "point_a": 2,
            "point_b": 5,
            "dir": 1,
            "curve": 4,
            "camera": 11,
            "length": 13
        },
        {
            "name": "RE_LINE_6",
            "point_a": 6,
            "point_b": 3,
            "dir": 1,
            "curve": 5,
            "camera": 12,
            "length": 3
        }
    ],
    "cameras": [
        {
            "func": 1,
            "params": [ 9724, 0, 1000752, 0, 0, 0, 0, 0 ]
        },
        {
            "func": 1,
            "params": [ 9724, 45046, 1200752, 0, 0, 0, 0, 0 ]
        },
        {
            "func": 1,
            "params": [ 5689, 45410, 917432, 0, 0, 0, 0, 0 ]
        },
        {
            "func": 1,
            "params": [ 9724, 0, 1200752, 0, 0, 0, 0, 0 ]
        },
        {
            "func": 1,
            "params": [ 6568, 0, 917504, 0, 0, 0, 0, 0 ]
        },
        {
            "func": 1,
            "params": [ 9724, 12278, 1000752, 0, 0, 0, 0, 0 ]
        },
        {
            "func": 1,
            "params": [ 6568, 0, 917504, 0, 0, 0, 0, 0 ]
        },
        {
            "func": 2,
            "params": [ 6568, 0, 917504, 0, 0, 0, 0, 0 ]
        },
        {
            "func": 9,
            "params": [ 62000, 9724, 1000752, 0, 0, 0, 0, 0 ]
        },
        {
            "func": 9,
            "params": [ 62000, 9724, 1000752, 0, 0, 0, 0, 0 ]
        },
        {
            "func": 9,
            "params": [ 0, 9724, 1000752, 0, 0, 0, 0, 0 ]
        },
        {
            "func": 9,
            "params": [ 62000, 9724, 1000752, 0, 0, 0, 0, 0 ]
        },
        {
            "func": 9,
            "params": [ 62000, 9724, 1000752, 0, 0, 0, 0, 0 ]
        }
    ],
    "curves": [
        {
            "handler": 1,
            "center": [ 1277952, 720896, 1015808 ]
        },
        {
            "handler": 1,
            "center": [ 1277952, 1835008, 1015808 ]
        },
        {
            "handler": 1,
            "center": [ 1277952, 1310720, 1015808 ]
        },
        {
            "handler": 0,
            "center": [ 0, 0, 0 ]
        },
        {
            "handler": 1,
            "center": [ 1277952, 786432, 1015808 ]
        },
        {
            "handler": 1,
            "center": [ 1277952, 1835008, 1015808 ]
        }
    ]
}
